{
  "id": "00000000000000000000000060",
  "execucao_id": "00000000000000000000000040",
  "snapshot_base": "ef182f39e9db2f517ccf9f9f523578eb85f83d8a6e2c6e859109a64e8dbbd1ed",
  "autor": "pedro",
  "motivo_do_lote": "Confirmar leitura",
  "operacoes": [
    {
      "ordem": 0,
      "marca_id": "00000000000000000000000050",
      "op": "remover",
      "antes": {
        "id": "00000000000000000000000050",
        "ancora": {
          "versao_id": "00000000000000000000000020",
          "bloco_id": "00000000000000000000000001",
          "inicio_utf16": 3,
          "fim_utf16": 5,
          "citacao": "🧭",
          "prefixo": "Um ",
          "sufixo": ", café e ﬁ."
        },
        "funcao": "conceito",
        "subfaixas": [
          {
            "inicio_utf16": 3,
            "fim_utf16": 5
          }
        ],
        "comentario": null,
        "origem": "parte",
        "validade": "resolvida",
        "visivel": true,
        "avaliacao": "nao_avaliada",
        "execucao_id": "00000000000000000000000040",
        "criada_em": "2026-09-20T18:00:00Z"
      },
      "depois": {},
      "motivo": "Redundante."
    }
  ]
}
